<?xml version="1.0" encoding="UTF-8"?>
<personas xmlns:xsi="http://www.w3.org/2001/XMLSchema-instance" xsi:noNamespaceSchemaLocation="ejercicio38.xsd">
    <persona dni="12345678Z">
        <nombre>Juan</nombre>
        <apellidos>García</apellidos>
        <telefono>924555555</telefono>
    </persona>
    <persona dni="87654321A">
        <nombre>Luisa</nombre>
        <apellidos>Pérez</apellidos>
        <telefono>954521235</telefono>
    </persona>
</personas>